Index,Sentence
3985,Il portait une chemise en chambray délavé.
3986,C'était sur la tête de la chienne.
3987,La torsion du cou avait entraîné la mort.
3988,Ils étaient courts et irréguliers.
3989,Parmi les derniers appels passés.
3990,J'ai aussi l'arrestation de l'équipe d'Oussama.
3991,Ça nous rendrait service.
3992,Si ça peut fonctionner.
3993,Les plaisanteries qu'elle subissait ?
3994,"Des toilettes qui fuient, ça s'entend."
3995,"À gauche du bureau, une porte."
3996,Il ne porte pas de montre .
3997,Il allait fermer sa boutique.
3998,Il travaillait avec sa chaîne de supermarchés.
3999,"Faites-moi confiance, cette garce."
4000,L'une des mendiantes était là.
4001,Elle tapota son front moite.
4002,Elle avait des oreilles en coquillage.
4003,Il avait cinquante-six ans.
4004,J'ai besoin d'une clope.
4005,"Garée devant la maison, la fourgonnette du coroner repartirait."
4006,Ayant subi le même sort .
4007,Elles voulaient déchiqueter la chair fraîche.
4008,"Elle nous accusait, moi et d'autres."
4009,L'interne a certifié sa présence.
4010,Ils étaient à côté de la hanche gauche.
4011,Je m'y intéressai de plus près.
4012,Quigg promenait son chien tous les soirs.
4013,Avez-vous jamais eu affaire à pareil tueur ?
4014,Une voisine aurait vu quelqu'un.
4015,Pour ces deux nouvelles victimes.
4016,Milo aurait voulu joindre quelqu'un.
4017,Il faudrait qu'on en fasse tous autant.
4018,Perdre mon temps à me justifier.
4019,"Quelques jours plus tard, elle était remontée."
4020,Il pencha la tête de côté.
4021,Elle susurre son prénom.
4022,"N’importe, fit-elle en tranchant l’air."
4023,"Plus de questions, s'il vous plaît."
4024,Il n'y avait que de minuscules taches rubis.
4025,Il était parfaitement situé.
4026,Il portait une chemise noire.
4027,Elle travaille les jours où je ne travaille pas.
4028,Et ceux Vita accusait.
4029,"Notre affaire, c'est le soin."
4030,A-t-elle été mariée ?
4031,Pour les pathologies aiguës.
4032,Il m'avait demandé une lettre.
4033,Il venait d'une bouche d'aération au sol.
4034,Pas cinq millions en tout cas.
4035,Je fais au plus vite .
4036,M. Quigg n'aurait pas résisté.
4037,Il était dans le bureau.
4038,Le médecin traitant non plus.
4039,Ils entendent un bruit dans le jardin.
4040,Il était grand ponte autrefois.
4041,Ce n'était pas trop loin de leurs boulots.
4042,Ils ne devraient pas se retrouver nez à nez.
4043,Il renvoyait les rayons du soleil.
4044,"À voir son jardin, c'est un perfectionniste."
4045,"Milo demanda ""Vous êtes réalisatrice ?"
4046,Il n’y a pas d’autre accès que celui-ci.
4047,Don a été policier.
4048,C'est une invite sublime.
4049,Le carton à pizza te paraît significatif ?
4050,Milo vira au cramoisi.
4051,Les fripouilles soutenaient que l'argent leur était confié.
4052,Qu'est-ce qu'elle a encore fait ?
4053,Ça se concentre autour du cadavre.
4054,"Oui, oui, c'est moi, Belle ."
4055,"Tu penses que c'est quoi, chéri ?"
4056,C'était  Mlle Dorothy Band .
4057,Il est passé de normal à furieux.
4058,Comment auraient-ils su qui c'était ?
4059,Elle n'avait rien commandé.
4060,Il y avait un flou artistique.
4061,La prochaine victime courait danger.
4062,"Oh mon Dieu, Hedy."
4063,Les affiliés ne tombent pas sur le même conseiller.
4064,Ne me demandez pas ce que c'est.
4065,C'est pour le dernier dossier.
4066,Qui pourrait lui vouloir du mal ? .
4067,Le parc des petits Indiens .
4068,Cela explique pourquoi je n'ai plus ma taille.
4069,C'est ce qu'il répéta.
4070,Il sera bientôt là.
4071,Comme la première fois .
4072,L'eau bleue se prolongeait.
4073,Aucune empreinte n'était précise.
4074,Nous nous en accommoderons.
4075,Elle a quelqu'un pour jouer les protecteurs.
4076,Il ne comprenait pas l'agitation.
4077,C’était la couverture idéale.
4078,Nous la rattrapâmes d'un mouvement réflexe.
4079,J'ai même été en poste en Afghanistan.
4080,Tant mieux pour eux.
4081,La mère lui a expliqué.
4082,C'était au Café Moghol.
4083,Il y avait peu de restes.
4084,Il jeta un coup d'œil à l'intérieur.
4085,Il y avait un collier étrangleur.
4086,Sa veste était impeccable.
4087,Mais ils cherchent à déménager.
4088,Il tira goulûment sur sa clope.
4089,Si je tombe sur un traîneau à chiens...
4090,Le volume agresse mes tympans.
4091,Elle n'a pas reculé.
4092,Les images resteraient logées.
4093,C'est une partie du problème.
4094,Ça ne semble être un meurtre crapuleux.
4095,Elle vous sautait dessus.
4096,Écœurés de quoi ?
4097,Si tu changes d'avis...
4098,Libre à vous de me voir comme un gant.
4099,Elle portait un haut mauve.
4100,Elles étaient prises dans les poils.
4101,...je te conseille les points d'interrogation.
4102,L'assassin avait longuement épié sa proie.
4103,On va devoir faire appel à un plombier.
4104,Ça peut paraître bizarre.
4105,Je dis que les deux sont envisageables.
4106,Investi en actions privilégiées.
4107,Il se posta devant la vitrine.
4108,"Ni celle du coroner, pour l'instant."
4109,À un honnête citoyen.
4110,Il fit des coups de klaxon.
4111,Il faisait des mutilations abdominales.
4112,Elle le faisait savoir.
4113,J'étais chez mon fils.
4114,Il a été attaqué et poignardé.
4115,L'eau est déjà chaude.
4116,Ils ne sont pas sujets aux sueurs froides.
4117,Il portait une cravate lacet en cuir.
4118,Il effectue des analyses ADN .
4119,Un psychopathe qui frappe au hasard.
4120,Il pesait soixante kilos.
4121,"Le mari demanda ""Pourquoi aurait-elle fait ça ?"
4122,Elles étaient parmi la chevelure.
4123,Il est tombé dessus par hasard.
4124,Il n'y avait aucune hésitation.
4125,Elle se demanda si elle avait tiré les rideaux.
4126,Il ne grommelait pas d'ordres.
4127,"Quelque chose vous est revenu, madame ? ."
4128,Vous ne trouverez pas grand monde.
4129,Il lui tient lieu de bureau annexe.
4130,Le stationnement est interdit après vingt heures .
4131,Elle prit un papier et un stylo.
4132,C'était un numéro avec l'indicatif 310.
4133,Son visage était grumeleux.
4134,Après deux crises de sanglots.
4135,Nous filâmes vers Temescal Canyon.
4136,Ce sont mes cassettes audio.
4137,"Non, Vita n’était jamais gentille."
4138,C'était grâce à un fixatif haut de gamme.
4139,Elle était satisfaite de cela.
4140,Comment ont-ils été tués ?
4141,Il a fallu lutter.
4142,"Ça va ?, s'enquit Milo."
4143,Le chien bondit vers nous.
4144,La salope a voulu récupérer.
4145,Y compris la décapotable.
4146,"Je suis vraiment désolé, madame Quigg... ."
4147,David a d'abord étudié à Princeton.
4148,Je présentai mon identité.
4149,Je lui fis part de la venue d'une amie.
4150,Libéra une bouffée de calme.
4151,Vita et lui se croisèrent.
4152,Vita n'était pas facile.
4153,Merci de m'accorder votre temps.
4154,Le cadavre gisait à trois mètres.
4155,Il n'y avait pas de nom de marque.
4156,"Ce soir-là, elle est sortie plus tôt."
4157,Il pianota au clavier.
4158,Il prit place dans un fauteuil.
4159,Je redémarre et repars.
4160,J'achète dans l'État voisin !
4161,On utilise des radio-isotopes.
4162,Les murs étaient nus.
4163,Elle n'est pas du genre à les afficher.
4164,N'importe qui connaissant Colin sait .
4165,La rue était dans le secteur sud-est.
4166,Avec un dessinateur pour un croquis ?
4167,Je pensais que c'était une plaisanterie.
4168,Elle ne parut pas accuser le coup.
4169,"Avant, c'était de l'intérim."
4170,Ils se croisèrent en examen.
4171,Ceci allait dans ce sens.
4172,Il me semble qu'il était marron.
4173,S'il insiste pour un rendez-vous.
4174,Elle m’a passé un savon.
4175,Ils bourrent trop la poubelle.
4176,Un vieil homme lisait le journal.
4177,Vous le soupçonnez de l’avoir tuée ?
4178,Elle devenait plutôt grognon.
4179,Si vous pouviez répondre à quelques questions supplémentaires .
4180,Il pensa aux titulaires de carte vermeil.
4181,Elle n'a pas d'enfants.
4182,Ses orteils étaient impeccablement laqués.
4183,"Pourtant, vous avez pensé à lui."
4184,Ils n'avaient pas l'identité de Vita.
4185,Le mobilier était tapissé d'une étoffe ocre.
4186,Si tu veux vraiment essayer.
4187,Mais il a bon cœur .
4188,Elle pensa à elle-même.
4189,C'était un superbe pin des Canaries.
4190,Son père lui inspirait un mélange.
4191,"Bon, je vais vous laisser opérer."
4192,"C'est possible, en effet."
4193,Je ne sais même pas comment.
4194,"Les exhibitionnistes, je connais."
4195,Des traces de sang.
4196,Sa curiosité de quoi ?  grogna Maria Thomas.
4197,Elle voulait me faire mon éducation.
4198,Une petite causerie entre spécialistes.
4199,Elle avait une façade en bois.
4200,Vous voulez savoir mon train de vie ?
4201,Il a fait chou blanc.
4202,Il édifia un nouveau sandwich.
4203,Elle permettait d'évaluer l'état des corps.
4204,Si j'ai du souci à me faire.
4205,Il est à l'arrière.
4206,"Vraiment, c'est possible ?"
4207,Cette piste ne donnera rien.
4208,Avait-elle sympathisé avec des collègues ?
4209,Je ne me focaliserais pas là-dessus.
4210,Sloat eut un mouvement de recul.
4211,Quelques taches jaunes parsèment sa tête.
4212,Cela fait penser à la schizophrénie.
4213,Il était derrière des couvertures.
4214,Ils avaient tranché la carotide.
4215,À propos du Dr U.
4216,Elle a déposé 583 000 dollars.
4217,Un vague gazouillis sortait de l'écouteur.
4218,Les psychopathes sadiques commencent tôt.
4219,Impossible de scruter ses pupilles.
4220,"Milo demanda ""Quelle raison aurions-nous ?"
4221,Elle avait une formation d'infirmière ?
4222,Elle défilait dans ma tête.
4223,"Oui, je passe quotidiennement."
4224,Il doit bien y avoir un point commun.
4225,Je perds donc mon temps avec Leventhal.
4226,C'est un type réglo.
4227,Pour ne pas l'apeurer.
4228,Il y avait un Infiniti QX gris.
4229,Je n'arrive pas à croire .
4230,Sept ans et huit mois.
4231,Il frappa au carreau.
4232,"Je demandai ""Quel genre d'emballage ?"
4233,"Moi, je suis à Beverly Hills."
4234,Personne n'était à l'abri.
4235,Elle se mit à cribler le torse.
4236,Elle prenait des plats à emporter.
4237,Elle évoque l'Angleterre victorienne.
4238,C'était plus pratique pour Hedy.
4239,Près de la hanche droite était placé un tee-shirt.
4240,Ostrovine posa ses paumes.
4241,Cela profite à Milo.
4242,Il remercia de le rappeler.
4243,Votre nom est apparu.
4244,Il suffit quasiment de prendre la liste.
4245,"Non, elle distingue un grognement viril."
4246,Il était gris et graisseux.
4247,"Ça ne serait vraiment pas possible, discrètement ?"
4248,Le mari et la femme se retirent.
4249,Je pense en termes de plan.
4250,Elle prit un papier et un stylo.
4251,Milo prit Sepulveda vers le nord.
4252,Il démarra en trombe.
4253,Ce sont des hommes blancs.
4254,Il était terrifiant si l'on s'y attarde.
4255,Milo parlait de façon technique.
4256,Vous me contactez pour quoi ?
4257,Un type a jeté un foie humain.
4258,Ils s'auto-motivent avec l'alcool.
4259,Elle indiquait un probable coup par-derrière.
4260,Ils ont tout leur temps .
4261,"Non, Vita ne faisait plus partie de ma vie."
4262,J'en ai tout à fait le droit.
4263,Belle Quigg s'était souvenue d'une chose.
4264,Elle recula d’un pas.
4265,Et voilà qu'elle s'allonge par terre.
4266,Des noms à nous souffler ?
4267,"En chemin, Milo réfléchit."
4268,Ils furent portés à la gorge.
4269,J'aurais averti la sécurité.
4270,Il remonte son pantalon.
4271,Elle avait un domicile ?
4272,Il y a des dentistes.
4273,Ils visitent les pizzerias.
4274,C'est peut-être un putois.
4275,Ils chassent le sanglier.
4276,Puis elle entend la porte du jardin.
4277,Avec un ou deux martinis.
4278,C'était peut-être une question.
4279,Elle est en simili cuir.
4280,Ce geste requérait force.
4281,On m'y a enseigné des rudiments.
4282,Elle a continué à le faire chier.
4283,Il me fallut attendre.
4284,Le fauteuil nous dépassa.
4285,Elle photographia le cadavre.
4286,C'était il y a trois ans.
4287,Il n'y avait aucune trace.
4288,Il y avait des parterres fleuris.
4289,Tout revient à la mode.
4290,"Tous les jours, Jay venait."
4291,Pas de bâche disposée sous le corps nu.
4292,"Très rude journée , dis-je."
4293,Pas de serviette disposée sous le corps nu.
4294,On s'est fait un match.
4295,Elle vous poursuit en justice.
4296,Il était un homme plaisant.
4297,Il y avait une Porsche Cayman jaune.
4298,Pour qui la méchanceté est pathologie.
4299,A-t-on dérobé de l'argent ?
4300,L'avocat m'a confié qu'elle a touché.
4301,Il contourna le bureau.
4302,Sloat prit un paquet de cigarettes.
4303,Il est parti dans la venelle.
4304,"Si elle avait un ordi, il a été fauché."
4305,Tout est devenu petit.
4306,Les traits de Maria Thomas se figèrent.
4307,Il capturait des souris.
4308,Le stationnement est interdit.
4309,Le père s'est levé à son tour.
4310,Il se gara sur une place livraison.
4311,Samantha Pelleter fit deux banqueroutes.
4312,"Oh mon Dieu, oh mon Dieu !"
4313,J'en étais à ma deuxième inspection.
4314,Où dois-tu la rencontrer ?
4315,Comme vous êtes baraqué... .
4316,J'étais certain qu'elle m'appellerait.
4317,Il comptait le faire d'ici quelques années.
4318,Il a été tué d'une balle.
4319,Ils ont décidé d'agir.
4320,Il avait vécu deux mois de plus.
4321,C'est Colin qui s'en occupait .
4322,Ils vérifièrent toutes les dépouilles.
4323,Vita travaillait chez Well-Start.
4324,Est arrivé à pied .
4325,Le sourire échoua loin du compte.
4326,Il l'avait aisément défait.
4327,Elle n'en disait jamais sur personne.
4328,Elle était tout sourire.
4329,"Bien sûr, patron !"
4330,"Elle demanda ""Vous ne parlez pas d'un sans-abri ?"
4331,Chacun ses responsabilités .
4332,Je m'attendais à de la résistance.
4333,Elle demanda s'il s'en prendrait à eux.
4334,C'était comme au cinéma.
4335,Il avait eu des dossiers dans l'assurance-maladie.
4336,Les gens plus âgés disaient ça.
4337,Louie a disparu .
4338,Elle dirait un manque de vraisemblance.
4339,C'est une canalisation qui fuit.
4340,Il plissa le front.
4341,Il avait droit à une montagne de légumes.
4342,Sa Perfection estime que je devrais le faire ?
4343,Puis-je poser des questions ?
4344,Il déboutonna sa veste.
4345,Elle a peu de kilomètres.
4346,C'était un lit double.
4347,Installez-vous où vous voulez.
4348,Je n'arrive toujours pas à y croire .
4349,Ces leggings prenaient des reflets roses.
4350,Elle ne sortait que pour faire ses courses.
4351,"Pas de problème, Alex."
4352,Pensez-vous qu'il y ait la moindre chance ?
4353,Dans quel secteur intervenait le Dr Usfel ?
4354,Il porte une chemise noire.
4355,Quand l’avez-vous vue la dernière fois ?
4356,Ils portaient la même tenue.
4357,Il rappellerait s'il trouvait quelque chose.
4358,Quand une page de dialogue...
4359,Je rapportai le verre à la cuisine.
4360,Voyons ce que vous relevez.
4361,Ce genre d'investigation est illégal.
4362,Cela n'ira pas aux oreilles des avocats.
4363,"Parfait, on a fait copain-copain."
4364,Tout le monde adorait Colin.
4365,Il ne restait qu'une queue vague.
4366,"Dans le salon, Belle Quigg avait la tête."
4367,Je lui ai collé un procès au cul.
4368,Papa ressasse cette histoire.
4369,Je ne vois pas d'éclaircie.
4370,Vita travaillait pour Well-Start.
4371,J'ai peine à imaginer une enfant heureuse.
4372,Vous puissiez imaginer des choses.
4373,Cela nous épargnerait un mandat.
4374,Je ne voulais pas rendre mon petit déjeuner.
4375,Elle lui rendait la pareille.
4376,Sa maison fut saisie.
4377,Elle pesait soixante kilos.
4378,Nous nous éloignâmes sans répondre.
4379,Elle porte un tee-shirt noir.
4380,Je suis sincèrement désolé.
4381,Il m'avait adressé deux courriels.
4382,Cela pourrait être une situation Tarasoff.
4383,Le silence régnait dans la rue.
4384,Il y avait un talus.
4385,Vita Berlin les avait accusés.
4386,Il y avait quantité d'arbres et de buissons.
4387,Elle parlait avec un accent jamaïcain.
4388,Elle présenta la femme plus petite.
4389,Il y avait une prédilection pour l'érable blond.
4390,Les muscles de ses maxillaires s'étirèrent.
4391,C'est un prix acceptable.
4392,Ils n'eurent plus de succès.
4393,Personne ne songeait à dresser des barrières.
4394,Personne ne correspondait au signalement.
4395,Sondra demanda si leur silence était un refus.
4396,Tu l'as signalé comme indice.
4397,"Au bout du compte, ça importe peu."
4398,Quelqu'un a-t-il été renvoyé ?
4399,"Oui, Zane est grand et costaud."
4400,Candace Baumgartner s'y trouve.
4401,Je ne risque rien à venir ici ?
4402,La monture de ses lunettes était rouge.
4403,"...tout baignera, alors ?"
4404,Aucun PV n'a été dressé dans les environs .
4405,S'il répond que non.
4406,Une bouteille de Merlot était bue à moitié.
4407,Milo lui montra son badge.
4408,Elle ne nous serait pas utile.
4409,"Non, ce n'est pas possible."
4410,ces mots du bout des lèvres.
4411,Je ne les ai jamais rencontrés.
4412,A votre avis ?
4413,De compagnies d'assurances ? .
4414,Une grosse femme en blouse le poussait.
4415,Elles n'étaient pas bouleversées.
4416,Il existe d'autres moyens de renouer.
4417,Je lui donnai un discret coup de coude.
4418,Ceux-ci concernaient les sans-abri.
4419,Colin n'avait pas de plan de carrière.
4420,j'en ai fini avec l'immobilier.
4421,Merci d’avoir surveillé les lieux.
4422,C'était il y a quatre ou cinq jours.
4423,Les murs étaient d'un beige anonyme.
4424,L'assassin pratiquait-il les arts martiaux ?
4425,J'ai gardé la radio d'origine.
4426,L'assassin ne s'était pas embêté cette fois.
4427,C'était accidentellement par un ami.
4428,Il me coupera les couilles.
4429,Les voilages étaient tirés.
4430,Il s'est garé dans le quartier.
4431,Il nous serra la main.
4432,Il y a des miettes sous le lit.
4433,Nous serions virés à la moindre incartade.
4434,Milo attendit que la demoiselle termine.
4435,Il y a eu transaction.
4436,Elle a été charcutée bien après.
4437,Le meurtrier a procédé soigneusement.
4438,Le fatras comprenait un tube de lubrifiant.
4439,Il les aligna soigneusement.
4440,Quelqu'un ou quelque chose rôde à l'extérieur ?
4441,"Bien sûr, qu'il travaillait ! ."
4442,Ils recroisaient ceux de la base de données.
4443,Milo demanda s'ils pensaient être en danger.
4444,C'est une bonne question.
4445,Elles seraient dans nos cerveaux.
4446,L'officier de permanence s'est adressé à Sa Splendeur.
4447,C'était un film d'horreur.
4448,Une petite quantité avait transpercé le tissu.
4449,Il prit divers pots de condiments.
4450,"Au besoin, on fera venir un plombier."
4451,Il portait un pantalon gris en toile.
4452,George est en train de divorcer.
4453,C'était un gâteau au sirop de rose.
4454,Elle était silencieuse comme une fente.
4455,J'ai cru qu'il était arrivé quelque chose.
4456,Vous ne parlez pas d'un sans-abri.
4457,Elle lista Cleve Dawkins.
4458,Ils en ont discuté au bureau.
4459,C'est ce que je dis.
4460,Il faisait moins chaud qu'extérieur.
4461,Elle m'ébouriffe les cheveux.
4462,La consigne vient de lui ?
4463,Il sera bientôt là.
4464,Elles l'ont été post mortem.
4465,Les jeunes ne connaissent pas.
4466,Il faut voir cela.
4467,C’est trop risqué pour une simple voiture.
4468,Ce qu'on m'avait inculqué m'a rendu service.
4469,Nous étions l'une à côté de l'autre.
4470,J'ai acheté un bouquet pas cher.
4471,Il comptait prendre sa retraite.
4472,C'était dans le reste de l'appartement.
4473,Ça fera trois semaines demain.
4474,Elle pensait s'il revenait.
4475,Il a la force physique et maturité.
4476,Dès que les techniciens seront là .
4477,Elle était blonde et boulotte.
4478,Vérifier qu'elle ne simulait pas.
4479,C'est peut-être un opossum.
4480,Il pensait qu'il était trop confiant.
4481,Il la serra brièvement.
4482,Elle a le culot de débarquer.
4483,Elle n'était pas bouleversée.
4484,Le cou rompu formait un angle impossible.
4485,C'était une manière d'exécution.
4486,C'était lors du Noël du service.
4487,Elle était bonne et pas mal foutue.
4488,Elle crut à un viol.
4489,Elle est striée d'argent.
4490,Tu le connais ?
4491,Ce meurtre visait spécifiquement Vita.
4492,"Hormis un lycéen, le personnel était là."
4493,Que vous travaillez pour la police ?
4494,Aucune enseigne n'était indiquée.
4495,Maître ? Un jeune bien élevé.
4496,Sa tête bascula sur le côté.
4497,Elle n'a pas eu d'enfants.
4498,Vita a eu recours aux tribunaux.
4499,"Non, ces génies-là agissaient subtilement."
4500,Je pensais que la victime était sans-abri.
4501,C'était un break de petite taille.
4502,Le parking abrité avait aussi des tuiles.
4503,Ils voulaient la réconforter.
4504,Avec qui se fâchait-elle ?
4505,Il était à Quantico.
4506,Un seul mot était écrit là.
4507,C'était une vraie folle.
4508,Vita était déjà là.
4509,C'est comme dans la chanson d'Ernie K-Doe.
4510,"Sinon, je vais m’intéresser à la mode masculine."
4511,Avez-vous rencontré un psychopathe sexuel ?
4512,Nous n'y étions pour rien.
4513,A-t-il eu recours à la terreur?
4514,Elles refroidissent à vitesse grand V.
4515,Je crois bien que je n'ai jamais vu .
4516,Elle était la quarantaine.
4517,Il était séparé du bâtiment principal.
4518,C'était sur leur compte joint.
4519,Il portait une cravate à motif cachemire.
4520,Milo tenta de joindre Alex.
4521,C'est un vieil objet.
4522,Je veux bien qu'on ait fait le ménage.
4523,Une feuille blanche était placée sous le talon gauche.
4524,Ne me regarde pas comme ça.
4525,"Agent Gates, n’hésitez pas."
4526,Elle avait environ le même âge.
4527,Nous avions presque toujours raison.
4528,Je ne sais pas trop.
4529,Son estomac ne le tolérait pas.
4530,Il lui tourna le dos.
4531,Je le sais parce qu'elle ratait souvent la cible.
4532,Rien ne leur a été signalé hier soir .
4533,Si ces deux victimes n'apportent rien de nouveau...
4534,La marchandise était proposée avec parcimonie.
4535,Alcool plus effet de surprise pour Vita.
4536,Elle avait de la bile dans les veines.
4537,Ce ne sont pas des chiens d'attaque.
4538,Une cravate de boyaux ! Mon Dieu !
4539,Mais la réalité n'est pas toujours conciliante.
4540,Comme si rien n'était arrivé.
4541,Je ne l’ai pas revue.
4542,Il y avait un interphone en bakélite.
4543,Notre victime s'est fait charcuter.
4544,Cela prit une affaire de minutes.
4545,Entre Sunset et le portail .
4546,La cuisine était vide.
4547,Elle ressasse les souvenirs d’Europe.
4548,Il a épongé au fur et à mesure.
4549,Il appela Moe Reed.
4550,"Dans une autre vie, j'étais infirmière."
4551,Il s'empara de la canette.
4552,Le mari reconnut que c'était leur devoir.
4553,On était là pour bosser.
4554,L'enquête sur les meurtres était au point mort.
4555,Mais rien de suspect.
4556,Ce point m'échappe pour l'instant.
4557,Pas besoin de ramasser les crottes .
4558,Il était vraiment en pétard.
4559,Ce n'est souvent qu'un répit.
4560,Bonne chance à vous.
4561,Cela suffit dans la plupart des cas.
4562,Il la ramena sur sa paupière.
4563,Le fumier m'a quittée ensuite.
4564,Le mari une maîtresse ?
4565,J'ai l'impression qu'elle était casanière.
4566,Je dis que le tueur avait neutralisé Quigg.
4567,Il demanda une autre histoire.
4568,Le divorce se passe mal.
4569,Désolé pour le malentendu.
4570,Je me débarrasse de son nom.
4571,qu'il avait affaire à un cinglé.
4572,Cela commence à être long.
4573,Ils ne font pas d'histoires.
4574,Mais un défaut comme la méchanceté...
4575,Chacun reçoit certaines cartes.
4576,Il y avait un problème psychiatrique.
4577,Le synthé est omniprésent.
4578,Colin est formidable .
4579,Gare à toi si tu ne files pas droit.
4580,Je sais que tu ne l'as pas harcelée.
4581,Mais je pense que Barron était un obstacle.
4582,Cela n'a rien à voir avec la fillette.
4583,Puis la gamine s'est mise à faire des bruits.
4584,Il était bienveillant mais distrait.
4585,Il a peut-être dissimulé le cadavre.
4586,Cette teinte se voit dans les morgues.
4587,Il y avait un emballage par terre.
4588,La vue n'est pas désagréable.
4589,La méchanceté était un moyen.
4590,C'est bon et pas cher.
4591,Il voulait mettre au point une stratégie.
4592,Nous avons des scripts.
4593,Il serpentait sur la cage thoracique.
4594,Elle a débarqué en pleine nuit.
4595,Ils sont retroussés aux coudes.
4596,Désolé de vous avoir inquiété.
4597,C'était peut-être aussi pour les autres.
4598,"Sinon, à quoi bon avoir un ?"
4599,Aucun bien immobilier enregistré.
4600,Vous tenez à l'entendre de ma bouche ? .
4601,Cette position plaît à son homme.
4602,Il devinait qu'ils étaient flics.
4603,Nous avons là une guêpe.
4604,C’est une vraie folle.
4605,Sa mère a voulu me prévenir.
4606,Elle était assez récente.
4607,La porte se referma.
4608,Il lui donna des leçons d'anatomie.
4609,Cette personne devait présenter l'assignation à Parnell.
4610,Je vais perdre mon travail aussi.
4611,Même le personnel nécessaire.
4612,Il croisa les bras.
4613,Il était le plus grand des deux.
4614,"Si ça ne donne rien, recommencez."
4615,Elles avaient une vingtaine d'années.
4616,Cela le mine beaucoup.
4617,C'est un mobile très classique.
4618,Il était près de Sepulveda Boulevard.
4619,"Je demandai ""Qu'avez-vous relevé ?"
4620,Ça remonte à quinze ans.
4621,Il portait un pull-over orange brûlée.
4622,Personne n'a été arrêté.
4623,Pas de nom de famille.
4624,Le cadavre réapparaît sans cesse.
4625,Ce n'était pas une affaire.
4626,Aucun signe de lutte.
4627,Elle a dû les froisser.
4628,"Milo demanda ""Aucune ?"
4629,Elle disait qu'on la martyrisait.
4630,Rien ne sera facilité.
4631,Elle avait besoin de penser.
4632,Elle tendit la feuille à Milo.
4633,"C'est avec un peu de cœur, non ?"
4634,J'ai pratiqué le karaté.
4635,Ils s'en tiennent au scénario.
4636,Elle sent le doute revenir.
4637,C'est un drame horrible.
4638,Peut-être serez-vous plus disert.
4639,Mais il y a du neuf.
4640,Ils parurent se détendre.
4641,Vous aurez votre dynamite psychologique.
4642,Vita raccrochait avant qu'ils ne se plaignent.
4643,Ils étaient vert éclatant.
4644,Je bossais de nuit.
