Index,Sentence
11881,Il demande si Raul est rassasié.
11882,Il portait un pantalon kaki.
11883,Le secret médical ne s'applique pas.
11884,C'était suffisant pour faire des margaritas.
11885,Il est déjà plus intelligent.
11886,Il était avec la famille Banforth.
11887,Son cuir était graisseux et râpé.
11888,"Quoi de neuf, demandai-je."
11889,Petra a parlé à un policier.
11890,Son meurtre est lié à Ventura.
11891,Quand il avait postulé à Atascadero.
11892,Je me garderai bien d'afficher ce portrait!
11893,Elle laissait un fils.
11894,Quelques jours après votre passage.
11895,Robin nous rejoignit ensuite.
11896,La réception est fermée à clé.
11897,C'est là que vous y êtes.
11898,On a interrompu votre soirée.
11899,Lui-même a peut-être des problèmes.
11900,"Ailleurs, il était question de recherches."
11901,Ils ont retiré la plaque.
11902,Le central de Beverly Hills me les prête.
11903,Quelques minutes suffirent.
11904,Louie leva la tête une fois.
11905,Elle fait une moue indifférente.
11906,Tu arrives à l'appartement de Quigg.
11907,Elle était avec son chéri.
11908,"Mais oui, mais oui."
11909,Il est le comparse de Huggler.
11910,Milo inspira une bouffée d'air frais.
11911,Il pourrait me rembarrer aussi.
11912,Ce fut par pure bienveillance.
11913,Les fenêtres étaient plus petites qu'ailleurs.
11914,C'est toi qui dis que quelqu'un t'en veut.
11915,Il est paresseux.
11916,Ces mormons venaient d'Ojai.
11917,Je ne raterais ça pour rien.
11918,Ils étaient à trois mètres l'un de l'autre.
11919,C'était une mine d'or.
11920,Il n'est pas obligé de lâcher des infos.
11921,Il voulait être crédible à Beverly Hills.
11922,Il me fit signe de le rejoindre.
11923,Vita avait laissé entendre.
11924,Hum. Je l'ai eu à bon prix.
11925,Je réfléchis à la situation.
11926,Elles descendent ici pour commettre leurs forfaits.
11927,"Merci infiniment, dis-je."
11928,Je n'ai pas laissé de message.
11929,Pourquoi voudrais-tu qu'il n'y ait pas accès?
11930,Elle regarde le dessin de Shimoff.
11931,Il pensait à un angora coincé.
11932,La cicatrice était au cou.
11933,C'était un pliage origami.
11934,Elle contenait du matériel chirurgical.
11935,Il voulait préserver son accord d'État.
11936,Le gars qui faisait des jeux ?
11937,Ils étaient plus clairs aux pointes.
11938,Son bureau était encombré.
11939,Cela ne donna rien.
11940,Il ne connaît pas votre monsieur.
11941,Je ne souhaite pas des réponses.
11942,Le sexe féminin était déjà établi.
11943,Il se posta derrière de hautes herbes.
11944,"À onze heures, Milo bâilla."
11945,Je vis dans un palace désormais.
11946,Vingt minutes passèrent sans reparaître.
11947,J'ai atteint un parking digne d'un stade.
11948,Elle ne figurait nulle part.
11949,"Malheureusement, la maladie de Parkinson en a décidé."
11950,J'étais ravi de découvrir un nouvel environnement.
11951,Ou sur tout le périmètre.
11952,Elle disait : Alex.
11953,"Bon,  soupira Milo."
11954,Aux divagations d'un déséquilibré?
11955,Il balayait le sol.
11956,Une institutrice demanda son secret.
11957,Vous êtes peu narcissique.
11958,Raul ouvre son dossier.
11959,Serait-il possible de se rencontrer ?
11960,Ce chien semblait très âgé.
11961,Cahane résidait au rez-de-chaussée.
11962,C'était un sac informe par-dessus chemise.
11963,Elle était pneumatique.
11964,Son mentor le façonne en arme.
11965,Le plâtre blanc est apparent.
11966,Elle avait un vrai talent.
11967,Aucun fou ne se cache ici.
11968,"Non merci, monsieur."
11969,"Non, pas s'il prend ses médicaments."
11970,Il n'y avait aucun système apparent.
11971,Harrie a été interpellé là-bas.
11972,Il peut s'estimer heureux.
11973,Elle suivit son conseil.
11974,Belle Quigg n'a pas souhaité reprendre.
11975,Ils ronflaient à l'unisson comiquement.
11976,Il portait des lunettes écaille.
11977,C'est déjà la bonne spécialité.
11978,Tu as souligné que l'assassin prend plaisir.
11979,La couleur des cheveux ?
11980,La puanteur était insoutenable.
11981,Jernigan était absente.
11982,Pas s'il abandonne les lieux.
11983,Il était à l'ouest du Mississippi.
11984,"Bernhard Shacker, c'est son nom."
11985,C'était à Beverly Hills.
11986,Des victimes distinctes.
11987,Il y avait des maladies génétiques.
11988,Elle n'a pas voulu reprendre Louie.
11989,Ecchymoses noires et bleues à la lèvre.
11990,Le policier ne savait pas.
11991,Deux femmes passaient en voiture.
11992,Cahane se détendit soudain.
11993,Borchard contempla le véhicule.
11994,Elle franchissait un haut portail grillagé.
11995,Quand donc vous a-t-il remercié ?
11996,Elle les laissa explorer librement.
11997,Je pourrais tenter de lui expliquer.
11998,Il s'appelait Rubenfeld.
11999,Il trouva une autre boîte.
12000,Elles voulaient réussir au mérite.
12001,"D'accord, je doute de le trouver."
12002,Les brillants étaient aux oreilles.
12003,Elle reconnaissait James Harrie.
12004,Il était récompensé d'une papouille.
12005,C'était comme gifler le tronc chêne.
12006,Je ne peux expliquer pourquoi.
12007,"Alors, qu'a fait ce Huggler?"
12008,Je secouai la tête.
12009,Elle se montre réceptive.
12010,Cahane n'était pas dans l'annuaire.
12011,Vous ne pouvez pas comprendre.
12012,On régressait complètement quand il était là.
12013,Il avait appris que l'hôpital allait fermer.
12014,Il secouait délicatement le bocal.
12015,Ils étaient soigneusement roulés.
12016,Une piste de thyroïde se précise.
12017,C'était il y a longtemps.
12018,"...rééquilibrer les choses, m'a rappelé une phrase."
12019,Huggler en profita pour se retourner.
12020,Il s'éloigna de quelques pas.
12021,"En route vers la sortie, je m'approchai."
12022,Ils râlent quand il n'y a pas wifi.
12023,On était presque sûr d'une chose.
12024,Comme vous l'a expliqué Dr Angel.
12025,Et pas très porté sur la conversation.
12026,"À un certain âge, on voit disparaître ses amis."
12027,Vous êtes seule responsable.
12028,Ils étaient à deux.
12029,Celui qui a évalué Vita Berlin ?
12030,Je suis en route.
12031,Il pourrait s'en sortir également.
12032,On lui ouvre le cou.
12033,Un véhicule est prometteur.
12034,Le bureau en noyer était nu.
12035,Le Dr Vanderveul avait des rendez-vous.
12036,La vie était en autarcie.
12037,On va faire un tour à Camarillo.
12038,Eccles a demandé de l'argent.
12039,Il fut réalisé par ordinateur.
12040,Il joignit Hedy.
12041,Trois autres étaient glissés.
12042,Elle avait seize ans.
12043,Il a réglé avec des petites coupures.
12044,Elle a environ vingt-huit à trente ans.
12045,Elle nous demanda de ne pas nous montrer.
12046,Il y avait des parterres de succulentes.
12047,"Oui, si Harrie pensait."
12048,Pitty l'a observé longtemps.
12049,Et je fais quoi en attendant ?
12050,Il bénéficiait d'un statut protecteur.
12051,Il devenait agressif sous alcool.
12052,Le rapport du Dr Wilkinson arriva.
12053,Une annonce préenregistrée apparut.
12054,"Bonne idée, se félicita Petra."
12055,Il avait sympathisé avec ce greffier.
12056,Elle pourrait m'expliquer la raison.
12057,Les parterres étincelaient de couleurs vives.
12058,C'était sur son permis de conduire.
12059,Je lui fis part du mensonge.
12060,Si seulement il n'y avait que ça !
12061,La partie amputée a un peu terni.
12062,Je l'ai eue comme tutrice.
12063,Les gens disent des choses.
12064,La quantité était raisonnable.
12065,Elle plissa les paupières.
12066,Vous nous avez rendu service.
12067,C'était dans un quartier d'Encino.
12068,Milo se ganta.
12069,Il reniflait sans but précis.
12070,Les pointes de son poil grisonnaient.
12071,Elles ont eu maille à partir avec un homme.
12072,Il y subit un internement dur.
12073,Je vais parler à chef.
12074,De vieille eau de Cologne.
12075,Milo demanda de rester en ville.
12076,Ils perçoivent une menace chez tous.
12077,C'est vous qui me contactez.
12078,C'était après la fermeture de Ventura.
12079,Mais je doute que ça vienne d'un labo.
12080,Huit personnes épiaient l'immeuble.
12081,C'était pendant qu'il promenait son chien.
12082,Une sorte de mécanisme prit le relais.
12083,Elle a fini par lui sourire.
12084,L'État s'était engagé à trouver des solutions.
12085,Elle semait la mauvaise humeur.
12086,Il ne savait pas où aller.
12087,Ses dents s'entrechoquèrent.
12088,Il avait été réalisé par Shimoff.
12089,Les enquêteurs ne comprenaient pas.
12090,"Si quelqu'un commet un meurtre,"
12091,Faut-il tabler sur quelque chose?
12092,Elle était à cheval sur le secret médical.
12093,C'était dans son cerveau.
12094,C'était lors de son recrutement.
12095,Il descendit de la voiture.
12096,C'était la clinique chirurgicale Bayview.
12097,"Il y avait chambre froide, boucherie, laiterie."
12098,"La moitié du temps, ça foire."
12099,Aidez-moi à cerner la chronologie.
12100,Ce complexe était plein de noblesse.
12101,Il a commencé à s'éloigner.
12102,Le décès n'était pas suspect.
12103,Je le savais pour m'y être rendu.
12104,Il a débarqué un jour au cabinet.
12105,Raul Biro avait fait pression.
12106,Ma propre vie était un désastre.
12107,Il est inutile d'archiver quoi que ce soit.
12108,Elle lui lança : Vous êtes sans gêne !
12109,Cela va vous occuper à plein temps.
12110,Il avait des cheveux gris.
12111,Il a dû avoir droit à un traitement.
12112,À temps partiel.
12113,Il y eut la disparition d'un homme.
12114,La clinique donne dans l'expertise complaisante.
12115,"Puis, je fus pris sur Westwood."
12116,Ramos sourit un peu.
12117,Jamais 'le vieux'.
12118,Vous devriez l'interroger.
12119,"Je répondis : ""En effet."
12120,Il a lié la gratification sexuelle.
12121,Comment s'appelait-il donc ?
12122,Milo regarda à l'intérieur du véhicule.
12123,Il attrapait aussi des oiseaux.
12124,C'était depuis une centaine de mètres.
12125,"Sinon, retournez à la clinique de North Hollywood."
12126,Elle nous dévoila d'autres secrets.
12127,Elles ressemblaient aux quatre victimes.
12128,qu'ils ne s'occupaient pas de ça.
12129,Il tomba sur un officier.
12130,Ils sont le cadet de nos soucis.
12131,Je continuai à pianoter sur le clavier.
12132,Quelque chose qui aurait échappé à tout le monde.
12133,Les dossiers anciens seraient consultables.
12134,le Dr Mendes.
12135,Puis je m'efforce de ne penser.
12136,Tous ont été bétonnés.
12137,Dès que Cerise s'est endormie.
12138,Vivre aux crochets de l'hôpital public.
12139,Comment les soupçons furent éveillés ?
12140,Leur propriétaire tomba à 19h13.
12141,Il surveillerait l'entrée.
12142,C'était auprès de jeunes maltraités.
12143,Je vais appeler la police d'Oxnard.
12144,J'imagine que c'est à moi de disposer.
12145,Sa barbe était naissante.
12146,Une première infraction il y a cinq ans.
12147,Ma poitrine se contracta.
12148,Je crois bien qu'il était doublé.
12149,Soyez aimable d'adresser les chèques.
12150,D'autres membres s'y opposaient.
12151,Un cinglé qui se croyait du même camp.
12152,Ned marqua un nouvel arrêt.
12153,Il ferma les paupières alors.
12154,"Si tu le dis, Maria."
12155,"Avec Gertrude, c'était deux de chute."
12156,"Pourquoi, je ne saurais vous le dire."
12157,Je ne suis pas fou à ce point.
12158,Ce n'est pas l'élégance raffinée au sous-sol.
12159,Une certaine lenteur.
12160,Il avait un accord.
12161,Petra sourit sincèrement.
12162,La réaction efficace aurait été saisir arme.
12163,Il fallait stabiliser ses taux.
12164,"L'asile, on en rigole bien."
12165,Il devint écarlate.
12166,Pas d'eau ?
12167,Les enfants effrayants faisaient quoi ?
12168,Votre argumentation tient bon.
12169,J'ai infligé d'autres calembours.
12170,Pas de réponse.
12171,Un nouvel immeuble étincelant émergeait.
12172,Le temps défilait.
12173,il avait régné une animation tranquille.
12174,Il porta la main à son chapeau.
12175,"Milo rit, puis redevint sérieux."
12176,Le garçon fut placé au service spécialisé.
12177,J'en ferais mon principal suspect.
12178,Aucun homme ne portait de canadienne.
12179,C'était un braque allemand.
12180,Je réagis aussi d'instinct.
12181,"Après le décès de ma femme, j'ai eu l'impression."
12182,On vérifiera les motels miteux.
12183,Il chercha à garder l'équilibre.
12184,Elle ne parlait pas d'eux aussi.
12185,Il aimait la photographie.
12186,Nous atteignîmes enfin le champ d'artichauts.
12187,Cela sonna longtemps dans le vide.
12188,Il y a les sans-abri d'Hollywood Boulevard.
12189,Vous voyez bien que c'est désert.
12190,Sauf que j'ai appris que Vita est morte.
12191,L'Écume de Mer - un lieu de rencontre.
12192,Il ne se souvient pas du bonhomme.
12193,Son nom de famille était Macomber.
12194,Sean rougit un peu.
12195,Un avocat de San Diego l'est.
12196,"Couic, le prof Quigg."
12197,J'avais toujours peur de le voir débarquer.
12198,Gertrude m'a tenu à l'écart.
12199,Nous l'avions surnommée la méchante.
12200,Milo n'avait pas attendu.
12201,J'ai essayé toutes les orthographes.
12202,qu'elle veut le croire.
12203,"À ce stade, je ne suis pas certain."
12204,J'ai tout fait pour aider le garçon.
12205,Il fit demi-tour.
12206,Je voulais que Cerise soit au calme.
12207,Il rend les armes plus vite que prévu.
12208,Il orienta le véhicule face au champ.
12209,Si par hasard cette femme s'y trouvait.
12210,Alors je préfère ne pas savoir.
12211,Milo a flaire l'attirance.
12212,Les renforts étaient trop tardifs.
12213,En travers de la pomme d'Adam ?
12214,"Moi, je suis professeur de golf."
12215,Milo facilita le transfert des ossements.
12216,Nous avions quartier libre.
12217,J'ai bondi de ma chaise.
12218,Il m'a accusé de vouloir l'enfermer.
12219,Pas de broussailles ?
12220,Je décrivis le service isolé.
12221,Il suggéra de servir une salade de thon.
12222,Elle ne s'en souvient pas.
12223,Je suivis Milo derrière eux.
12224,Il avait eu belle allure autrefois.
12225,Il se rappela qu'il l'avait lancé.
12226,Je plonge pour de bon dans le désespoir.
12227,Il le joignit.
12228,Borchard inspira plusieurs bouffées.
12229,qu'elle ne sait pas.
12230,Il avait un nez crochu.
12231,Borchard tourna et longea la haie.
12232,Quant à l'amie d'Eccles.
12233,Je m'interroge sur ce qui a pu.
12234,Il y avait du bœuf séché.
12235,Ostrovine soupire et se plaint.
12236,Il voulut prendre son verre.
12237,C'était un noir baraqué.
12238,Nous aurions mieux fait de rentrer.
12239,L'ecchymose était à la lèvre supérieure.
12240,J'ai eu la réaction naturelle du thérapeute.
12241,Il ne transportait rien d'illicite.
12242,C'était la seule fois.
12243,Nous avons mangé le riz.
12244,Ce sacré Harrie ne s'est pas embêté.
12245,Il pourrait acheter un magazine.
12246,J'en ai donc parlé au Dr Angel.
12247,On nous dépeint comme poltrons.
12248,Il y avait des infirmiers et aides-soignants.
12249,Il revint la mine impassible.
12250,C'était une enseigne en belles lettres.
12251,C'était en dehors des horaires.
12252,Huggler voulut dire quelque chose.
12253,Le psychologue ne s'était pas joint.
12254,Ils ne mangent pas au restaurant.
12255,Elle avait diffusé un reportage.
12256,Une ampoule grillagée était fixée.
12257,Il agita doucement le liquide.
12258,Je dois avouer que je comprends.
12259,Il y avait quatorze cents en plus.
12260,L'établissement venait de fermer.
12261,De quelle quantité de ruban dispose-t-on ?
12262,C'était de ce qu'il restait d'orteil.
12263,Il n'a laissé aucune trace.
12264,J'avais devant moi un vieillard tourmenté.
12265,Milo sortit et verrouilla les serrures.
12266,La pochette était violette et jaune.
12267,Wilkinson estimait qu'elles avaient accouché.
12268,Un calme immobile revint.
12269,On a retrouvé la voiture.
12270,Treize véhicules supplémentaires étaient là.
12271,Le chiffon avait encore rougi.
12272,C'est un vol d'identité.
12273,L'idée est venue d'elle.
12274,Je chercherai sur Rosetta.
12275,Son protégé y fut transféré.
12276,Il nous regarda de nouveau.
12277,Il les tend à Petra.
12278,Ou une attaque.
12279,Il a trouvé plus jouissif de le voir souffrir.
12280,Il y avait des couteaux.
12281,C'étaient les patients à risque faible.
12282,C'était de la terre brune.
12283,Je dis qu'Huggler devait être impliqué.
12284,De nouveaux faits nécessitaient un changement.
12285,Moe et Sean écument les kiosques.
12286,Le but était de faire passer l'horreur.
12287,Je procédai à des évaluations.
12288,Personne ne pénètre sans autorisation.
12289,Ils ont fini par l'enfermer.
12290,Je conçois bien comment ça s'est joué.
12291,Il déambulait toujours là.
12292,La dernière dessert La Mer.
12293,Les villes côtières reviennent toujours.
12294,Rien de répugnant.
12295,Les trois repas y sont assurés.
12296,Les choses se compliqueraient alors.
12297,La tête conservait sa noblesse.
12298,Ce sont des sévices déjà pratiqués.
12299,Il avait un épais dossier.
12300,Elle repartit et stoppa à nouveau.
12301,Ils étaient de bons professionnels du prétoire.
12302,Eccles a connu un Pitty.
12303,L'organisme de Cerise est hypersensible.
12304,C'était là où le sang gouttait.
12305,"Prends ta soirée, Raul."
12306,Je demandai les coordonnées actuelles.
12307,La compagne de Lem Eccles.
12308,Il existe une chance infime.
12309,Cette façon de manger est typique.
12310,"Si Grant Huggler s'introduit ici,"
12311,Mes articulations font des leurs aujourd'hui.
12312,Il était chirurgien à la clinique Bayview.
12313,Il est froid et calculateur.
12314,Louie ferma les yeux aux anges.
12315,Il sait jouer les types normaux.
12316,Mes recherches sur Huggler n'avaient rien donné.
12317,C'était un âge idéal.
12318,Il donna un coup d'accélérateur.
12319,Il a dû être transféré.
12320,Je veux bien me renseigner pour vous.
12321,J'ai supposé qu'elle parlait des patients dangereux.
12322,Ils se rapportaient à diverses pensions.
12323,Nous n'avons que des témoignages équivoques.
12324,Il n'y a aucun doute possible.
12325,Il s'est persuadé que le gardien l'a fait.
12326,Mais faute de détails...
12327,Il était trop jeune pour être gardien.
12328,Un polo sous la canadienne.
12329,Et que venait-on y faire ?
12330,Vous aviez accès à toutes sortes d'informations.
12331,Biro partira tout de suite.
12332,"Soyez gentil, rangez-moi ça."
12333,Elle roulait vers la maison.
12334,"Alex, je compte passer l'après-midi."
12335,Il n'a pas subi l'examen.
12336,Il faisait des pauses vacillantes.
12337,Petra sentit qu'il s'était passé quelque chose.
12338,"oui, c'est Lem."
12339,Je parlais de la sollicitude de Gertrude.
12340,L'autre s'en donne à cœur joie.
12341,J'optai pour du café Kenya.
12342,Il était à Ventura comme patient.
12343,Quel rapport ?
12344,C'était un peu superfétatoire.
12345,"A Camarillo, c'est grand."
12346,Il est capable d'arriver et repartir.
12347,Elle portait des poignets brodés de strass.
12348,Que les enseignants en milieu hospitalier.
12349,Il avait les glandes déréglées.
12350,Raul demande un médecin qui a vu Huggler.
12351,Les techniciens se décourageaient.
12352,Une manière d'atténuer le traumatisme.
12353,Il collabore avec un policier.
12354,Il me demanda de surveiller nos arrières.
12355,que le cabinet était à Camarillo.
12356,Il gardait le nez plongé.
12357,Il posa les mains sur sa tête.
12358,Nous avons deux individus ensemble.
12359,Il n'y avait pas un oiseau.
12360,Celle que Borchard nous avait montrée.
12361,Il ne délaissa pas son portable.
12362,Il est venu au moins deux fois.
12363,Un homme à la bouille ronde s'y trouvait.
12364,Elle s'en tient à sa frange pratique.
12365,Ces menaces étaient à peine voilées.
12366,Ils invitent les magistrats.
12367,Shacker fut le premier tué.
12368,Il releva la tête alors.
12369,Je dépliai la feuille.
12370,Il nous rapporta des bagels.
12371,"À l'origine, il était prévu."
12372,"C'est dans mon secteur, Petra."
12373,Vous serez en soutien.
12374,Quelle est la procédure exacte ?
12375,Il était contraint de prendre un cachet.
12376,"J'ai déjà vérifié"", précisa Sean."
12377,"Arrêtez, je vous en conjure."
12378,Il y eut un silence.
12379,Il ne te reste qu'à l'appeler.
12380,Je roulais très lentement.
12381,J'ai dû y recourir.
12382,Il est plus détaillé que le premier.
12383,Il m'aurait tendu une planche.
12384,je le fais volontiers.
12385,Milo m'en dissuada d'un signe tête.
12386,Il devait consulter un médecin.
12387,Il soupira ensuite.
12388,Emil Cahane était directeur adjoint.
12389,"Il demanda : ""Je pourrais ravoir bouillie ?"
12390,Il était quinze heures passées.
12391,Qu'elle se sente en confiance.
12392,J'étudiai l'analyse comportementale appliquée.
12393,Quigg n'est jamais revenu chez vous ?
12394,Ils n'ont pas de dossier.
12395,Une voix féminine et chaleureuse prend le relais.
12396,Il lui a laissé sa carte.
12397,Il était d'inspiration cubiste.
12398,J'avais treize ans.
12399,Elles n'étaient pas compliquées à cerner.
12400,Ils avaient diverses appellations.
12401,"S'il y a des bois,"
12402,C'était avec notre assurance-maladie.
12403,Le type a vidé le rayonnage.
12404,Elle avait été formée en Angleterre.
12405,Il observa Milo puis moi.
12406,Milo flottait dans l'accoutrement.
12407,"Un cadeau, ce fut un dealer."
12408,Ha ! Ha ! Ha !
12409,Pourquoi pas un petit plaisir?
12410,Il murmura cela.
12411,Ces gens circulaient sur la 101.
12412,Il le fit rouler entre ses doigts.
12413,Quel angle d'attaque choisir?
12414,Il devait jouer avec des boyaux.
12415,Quelque chose bougea au loin.
12416,Il en était perturbé.
12417,Il y avait des énigmes.
12418,Je passai voir Robin.
12419,Elle répond à peu près tous les jours.
12420,Elle était dépourvue d'inscription.
12421,Lem Eccles était toqué.
12422,Le lieutenant Sturgis s'en félicitera.
12423,L'accès aux soins peut s'organiser.
12424,Les anciens locaux hospitaliers s'intégraient.
12425,Huggler a tué sa mère.
12426,Procéder avec prudence est requis.
12427,C'est la seule fois qu'elle a reçu un collègue.
12428,Il se fera un plaisir de répondre.
12429,Elle s'appelait Ed quelque chose.
12430,Maman a enfreint ses principes.
12431,Je lui décrivis les blessures.
12432,"Non, je mélange tout, ça ne va pas."
12433,Elle était près de l'embarcadère.
12434,vous aurez bien pire qu'un infarctus.
12435,Une opération très simple.
12436,Il a pris la mouche.
12437,Désolée de ne pas aider plus.
12438,Ça ne sentait pas la mort.
12439,Il devait être soigné.
12440,Il sirotait un soda marron.
12441,On l'étendait délicatement ensuite.
12442,Elle a été perçue par les agents.
12443,Il ne savait pas comment faire.
12444,L'agression de Colin Quigg ne colle pas.
12445,Il promenait son chien.
12446,Cela pouvait engendrer une rancune sérieuse.
12447,Son charme féminin perd de son effet.
12448,Elle était chez elle une fois de plus.
12449,Les chiens erraient sans but.
12450,Des pantoufles étaient à portée.
12451,Le shérif adjoint Aaron Sanchez...
12452,Il voulait rester dans un service ouvert.
12453,Son attitude tendue fut remarquée.
12454,Il l'a fait pour se venger.
12455,Mais tu as entièrement raison.
12456,La moitié des chaises de jardin sont occupées.
12457,Ces fichus ordinateurs acceptent sans broncher.
12458,Cela signifie qu'il avait onze ans.
12459,Il expira longuement.
12460,J'ai obtenu ses coordonnées.
12461,Les deux décennies de bénévolat signifiaient.
12462,L'allée centrale était repeinte.
12463,Ce rôle était confié à un gardien.
12464,Un gardien aurait pu empoisonner quelqu'un.
12465,"Il demanda : ""Six cadavres ?"
12466,J'étais stupéfait qu'un enfant si jeune.
12467,Mon père était originaire de l'Oklahoma.
12468,C'est n'importe quel homme.
12469,C'était un chuintement mouillé amplifié.
12470,Il disparut par l'ouverture entre les bibliothèques.
12471,"Ça y est presque, petit."
12472,Il y avait une canadienne.
12473,James Pittson Harrie avait été abattu.
12474,C'est un retour triomphal.
12475,Vraiment aucun problème.
12476,C'est celui de l'infirmière Joanne Morton.
12477,On est arrivé où il le souhaitait.
12478,Cela s'est passé quand Quigg enseignait.
12479,Il était au centre.
12480,La relation s'est cimentée ensuite.
12481,Elle était sur le coût de la vie.
12482,Il faut que je change.
12483,Elle fut aperçue pour la dernière fois.
12484,Elle n'était pas sa subalterne.
12485,Le trio repartit visiblement ravi.
12486,"Vas-y,  fit-elle doucement."
12487,Mais peut-être qu'il est obligé d'économiser.
12488,Ils se pointent pour contester.
12489,Vous n'avez aucune idée de cela ?
12490,Ils se sont occupés de Wainright.
12491,On pourrait mettre du ruban.
12492,Elle répète qu'ils n'ont aucun dossier.
12493,Comme l'a souligné Raul.
12494,On apercevait un bout de ciel bleu.
12495,La première chose à savoir est qu'il était fou.
12496,Des souliers à semelle crantée dépassaient.
12497,"Je demandai : ""Faire appel au SWAT ?"
12498,Les hautes herbes s'interrompaient bientôt.
12499,Si je lui transmettais votre numéro ?
12500,Il en avait accroché partout.
12501,Elle me facture à l'heure.
12502,Il était directeur adjoint là-bas.
12503,"Bon boulot, Sean !"
12504,Vous avez sacrée force.
12505,Il a accès aux médias.
12506,C'était comme technicien en psychiatrie.
12507,Le téléphone sonnait encore.
12508,Peut-être a-t-il trouvé plus jouissif.
12509,Les cadavres n'étaient pas empilés.
12510,Je suis un narcissique invétéré.
12511,La situation est délicate.
12512,que c'est elle qui l'a envoyé.
12513,C'était un vêtement trop chaud.
12514,Il la chargea d'avertir les autres.
12515,Je ne suis pas certain de souhaiter.
12516,Milo prit une bouchée d'agneau.
12517,Ces crises étaient liées à l'alcool.
12518,Ce qui a pu engendrer un Huggler.
12519,Il était un peu déphasé.
12520,Il n'y a pas de lien entre Ventura State.
12521,Milo se gratta le nez.
12522,Vous vaguez à vos occupations.
12523,Qui aurait connu ce tunnel ?
12524,Sur l'emballage marron était figuré.
12525,J'ai demandé qui enquêtait sur Vita.
