Index,Sentence
7948,Ramos sourit et sortit Winston.
7949,Il était contre le mur.
7950,Il y avait un garçon...
7951,Cela signifierait qu'elle est vivante.
7952,C'était chez l'enfant d'une séparation prolongée.
7953,Les avocats dirigeaient le monde.
7954,Il flairait les dépravations.
7955,Son regard était fuyant.
7956,Son supérieur était le Dr Saul Landesberg.
7957,Il a senti la puanteur.
7958,Milo appela les services du coroner.
7959,Je ne devais pas en dire trop.
7960,Il a seulement commandé.
7961,Il était garé à l'écart.
7962,L'enquête n'avance pas du tout.
7963,Sa main était rageuse.
7964,Une personne rencontrée à Ventura.
7965,Il n'était pas convié aux réunions.
7966,Un avocat ?
7967,Il sortait d'un gouffre hérissé.
7968,J'étais coincé sur Wilshire.
7969,La feuille avait été arrachée.
7970,Elle est réservée aux livraisons.
7971,Un environnement mettait l'accent sur le traitement.
7972,Il y avait de l'eau.
7973,Huggler était docile et coopératif.
7974,Ils attendaient de le cueillir.
7975,Il prévenait les autres.
7976,C'était un fibrome graisseux dans le dos.
7977,Il se jeta en avant de suite.
7978,Elle était une brillante interne.
7979,"Si on les a bouchés,"
7980,L'homme lui obéit.
7981,Un craquement sonore se fit entendre.
7982,Je me suis exclamé : Waouh !
7983,Le patient avait à peine 20 ans.
7984,Il était spécialisé dans l'immobilier.
7985,Il caressa son verre vide.
7986,S'il l'avait jamais connu.
7987,Il est redoutable et calculateur.
7988,"Ce sont des cuillers, des fourchettes."
7989,"Si jamais je le revois,"
7990,Il détailla les trois clients.
7991,C'était il y a onze jours.
7992,Il était toujours en activité.
7993,Facile de le traquer pendant ses randonnées.
7994,Huggler et Harrie cachaient leurs prouesses.
7995,Ce sera peut-être à moi.
7996,Il faut les séparer immédiatement.
7997,Pendant qu'elle regardait la télé.
7998,"Rien n'est sûr, John."
7999,Il écarta les jambes fermement.
8000,Peut-être doit-on s'en inspirer.
8001,Il se gratta les fesses.
8002,Il semblait laisser tomber tout espoir.
8003,Quigg a quitté Ventura il y a 25 ans.
8004,L'asile d'aliénés fut construit dans les années trente.
8005,Elle les feuillette et les fait passer.
8006,Docteur Cahane ?
8007,Elle était excellente.
8008,J'insisterai sur ce point.
8009,Ça te dit de manger un morceau ?
8010,"Vas-y, mon garçon. Sois productif."
8011,L'assassin entrait dans les demeures.
8012,Elle précise la graphie I-E.
8013,Eccles s'est emporté en le voyant.
8014,Milo eut le chef.
8015,Un aide-soignant demanda ce que c'était.
8016,Je pensai à ses victimes innocentes.
8017,Je dis qu'ils ont commencé lentement.
8018,Je dis : Oh non...
8019,Un arrêt tous les dix pas.
8020,Petra sortit son iPhone.
8021,Il jouait les guetteurs.
8022,Je l'ai rencontré plusieurs fois.
8023,Que savez-vous de la mère ?
8024,Ils n'osent pas aller dans les hôpitaux.
8025,Vous pourriez vous offrir un taco.
8026,J'avais les yeux grands ouverts.
8027,Petra n'avait pas touché sa salade.
8028,Les bureaucrates manquent de volonté.
8029,Il n'est nul besoin d'obtenir un diplôme.
8030,Harrie l'a suivi.
8031,Petra demande qui il a appelé.
8032,Nous atteignîmes Camarillo.
8033,Ces recherches n'avaient rien donné.
8034,C'était dans le cadre d'un recrutement spécial.
8035,Il grogna en réponse.
8036,"Il repartit, et moi aussi."
8037,Mais le V de la victoire collait pas.
8038,Il avançait comme un bon soldat.
8039,On se fait une bouffe.
8040,Celui-ci finit par sortir.
8041,Jamais 'le paternel'.
8042,Petra n'y toucha pas du tout.
8043,Je lui fis part du mensonge de Quigg.
8044,Elle était à l'entrée du tunnel.
8045,Ceux de l'unité des soins spécialisés.
8046,Il se trouve sur Hollywood Boulevard.
8047,C'était ensuite sur Westwood.
8048,Sauf que tu soupçonnes Quigg de mentir.
8049,"Rien pour la Nouvelle-Angleterre, New York."
8050,Ses yeux se mouillèrent.
8051,Harrie les aime.
8052,que c'est possible.
8053,Milo rêve de bavardages.
8054,Et avec ses habitudes alimentaires.
8055,Décrivez-moi ce vêtement.
8056,Il vendait de l'ecstasy.
8057,Eh bien !
8058,Son dernier véhicule immatriculé.
8059,Nous mîmes un nom sur chaque visage.
8060,Il était absent.
8061,Je cherche à reprendre contact.
8062,Un effort méritant fut fait.
8063,Il avait vendu toute une pile.
8064,qu'il est désolé.
8065,"Au revoir, monsieur."
8066,Il feignit de regarder par là.
8067,On internait plus facilement les gens.
8068,Il a le nez plongé dans ses magazines.
8069,Elle déchira le papier deux fois.
8070,Il s'apprêtait à faire main basse.
8071,Je voudrais lui montrer le résultat.
8072,Il aimait promener son chien.
8073,Ma femme et moi en avons profité.
8074,Ventura était comme une ville.
8075,"Des viols, des actes de nécrophilie et cannibalisme."
8076,Il devait prendre ma plume s'il postule.
8077,J'en connais quatre.
8078,Elle s'exprime en espagnol.
8079,Il y eut une contraction des sourcils.
8080,Sans la moindre certitude.
8081,Il était toujours en état de marche.
8082,Petra et Raul se répartissent le travail.
8083,Le motif? Vita l'a insulté.
8084,Il avait un étage.
8085,Il était maintenant ouvert.
8086,"De grands explorateurs, dis-je."
8087,Une couleuvre et même un chat errant.
8088,Ils étaient encerclés d'une grille rouge.
8089,Ces pratiques étaient terminées.
8090,Le temps n'était pas si chaud.
8091,Il le harcèle à Hollywood.
8092,Borchard nous lança un regard.
8093,Il flottait dans son blazer marine.
8094,Margaret Wheeling paraît indécise.
8095,Milo avait déjà utilisé ses talents.
8096,Nous nous sommes longuement expliqués.
8097,Je repense à Joanne Morton.
8098,Je doute qu'on réponde.
8099,Elle était courte et précipitée.
8100,Il planta fermement ses pieds.
8101,Ses cheveux blancs étaient plus longs.
8102,C'était par la longueur du fémur.
8103,Je parcourus les venelles sombres.
8104,Il parle tout seul.
8105,Elle plissa le front.
8106,"Une seconde, s'il vous plaît."
8107,Milo demande de le rembourser en résultats.
8108,Son portable entonna une mélodie.
8109,Huggler tomberait sous leurs balles.
8110,Nous présumâmes qu'il était en bas.
8111,Il n'y avait pas de contraintes mesquines.
8112,Huggler avait les joues ruisselantes larmes.
8113,Il déchiffrait ses propres hiéroglyphes.
8114,Robin sourit : Les gens changent.
8115,Elle a choisi le mauvais type.
8116,Vous a-t-elle parlé de moi ?
8117,Au bout d'une avenue sinueuse.
8118,Ce n'était pas mortel.
8119,Il fascine la plomberie du corps humain.
8120,Il est possible d'être étripé.
8121,Sa voix devint plus forte.
8122,Fais-le en détail.
8123,Il me gratifia d'un coup de langue.
8124,Ne me remerciez pas.
8125,Ça me semblait une bonne idée.
8126,J'ai durci ma voix.
8127,Il s'est évanoui peut-être.
8128,Peut-être accepterait-elle de m'expliquer la raison.
8129,que le Dr Keefer va arriver.
8130,Ce fut une première réussite.
8131,Elle avait un problème d'alcool.
8132,Le Dr Shacker a vidé les lieux.
8133,Il fallut déranger Maria Thomas.
8134,Il n'en retira pas le plastique.
8135,Un air de flûte succéda.
8136,Le Dr Mendes communique les renseignements.
8137,Milo lui indiqua l'endroit.
8138,Huggler fut interpellé.
8139,Il demande s'il y a des questions.
8140,Elle était très bonne.
8141,Et le V de la victoire.
8142,Les patients passent trop peu de temps.
8143,Le chirurgien devient le patient.
8144,Il gémit doucement.
8145,Ils avaient une tenue décontractée.
8146,Elle détourna le regard alors.
8147,Il a déversé sa parano sur moi.
8148,Cerise avait changé d'avis.
8149,Mais je suis incapable de dire pourquoi.
8150,Ce serait une vengeance symbolique.
8151,C'est une installation rudimentaire.
8152,Il a baissé sa garde.
8153,Mais il avait un service personnalisé.
8154,Ils m'ont été adressés.
8155,Cela permet d'être polyvalent.
8156,Je m'autorisai à descendre prudemment.
8157,Elle était en tête à tête.
8158,Faites-moi confiance sur ce point.
8159,Et s'il existait un lien plus personnel?
8160,La chaussure avait un bout arrondi.
8161,Il s'est servi de la pierre à aiguiser.
8162,Je n'avais pas idée.
8163,Voilà un détail singulier.
8164,Son comportement était calme.
8165,Il doit le faire avec Banforth.
8166,Il avait pris quelques kilos.
8167,J'ai caressé Blanche doucement.
8168,C'était durant ses années londoniennes.
8169,La famille Banforth était au Bijou.
8170,Il avait un accent germanique ridicule.
8171,Cette dalle était en béton.
8172,S'il y a quoi que ce soit.
8173,Il ne nous reste qu'à filer le faux psy.
8174,Elle était besogneuse pour déféquer.
8175,Il y avait une bonne âme.
8176,Milo fit une entrée en matière.
8177,Une fine chaîne en or brillait.
8178,Elle laissait aussi le Dr Ava McClatchey.
8179,En quel honneur ?
8180,Appelle-t-on tous les endocrinos ?
8181,J'avais veillé tard moi-même.
8182,Il y a des acronymes.
8183,Gertrude Vanderveul veilla à m'en tenir éloigné.
8184,Il avait un col bénitier.
8185,J'ai remarqué le manteau.
8186,Nous n'avons jamais reçu de plainte.
8187,Je suis resté sans voix.
8188,"Il demanda : ""C'était quoi ce sandwich ?"
8189,Elle disait : Sois content de tout.
8190,Il était un petit crétin maniéré.
8191,Je demandai : Les enfants les plus effrayants ?
8192,"À l'époque, Huggler et Harrie dissimulaient."
8193,Si on changeait de sujet ?
8194,Elle a pris un flingue.
8195,Elle-même avait-elle traité ces patients ?
8196,J'ai voulu y retourner à tête reposée.
8197,La porte d'entrée était fermée.
8198,C'est de l'argent aussi facile.
8199,Ce suivi devait être satisfaisant pour les patients.
8200,Il était responsable des malheurs de Huggler.
8201,Le shérif adjoint Sanchez sortit.
8202,Cela a pu faire l'affaire.
8203,Il paraissait vraiment tout petit.
8204,Il était un homme cordial.
8205,Le psychologue s'appelait Bernhard Shacker.
8206,Elle étudiait à UC Santa Cruz.
8207,C'était dédié aux criminels.
8208,Des rouleaux de papier hygiénique étaient là.
8209,La Commission de santé mentale m'a appris.
8210,J'actionnai la poignée.
8211,Il remit le dessin à Moe Reed.
8212,Milo laissa un message.
8213,qu'on grandit vraiment.
8214,J'aimerais bien être lieutenant.
8215,Aucun d'Emil Cahane.
8216,J'ai eu l'impression qu'ils étaient venus ensemble.
8217,Les herbes hautes s'interrompaient.
8218,C'était du liquide ambré.
8219,Elle était hargneuse.
8220,Ça vous évoque quelque chose ?
8221,"Au troisième dispensaire, Raul Biro cherche."
8222,Où résidait-il avant son hospitalisation ?
8223,Elle était oubliée sur le feu.
8224,Ils étaient bien installés là.
8225,C'était donc le croquemitaine effrayant.
8226,Mais ça vous intrigue.
8227,Un petit passage aux toilettes.
8228,"Moi, sur la banquette arrière."
8229,Les résultats étaient prévisibles toujours.
8230,C'était avec des chiffons propres.
8231,Il n'y a pas eu la moindre évasion.
8232,"Là-bas, on ne posait pas de questions."
8233,Nous tenons enfin un visage.
8234,Le véto devra attendre.
8235,Elle a été assassinée.
8236,Cela remonte à une éternité.
8237,Le manteau était insolite.
8238,La caisse de retraite certifie cela.
8239,Sur un guéridon en acajou.
8240,Il y avait deux appartements libres.
8241,Je vais lui parler.
8242,C'était là que nous les avions vus.
8243,Inutile de vous préciser son État d'origine.
8244,Un enfant dessine sa famille.
8245,Le shérif a songé à cela.
8246,Il doit y avoir un accès.
8247,Elle ne sait rien de tout ça.
8248,C'était trois ou quatre mille.
8249,Peut-être que Huggler lui fut amené.
8250,Il enseignait à des enfants handicapés.
8251,Il avait des bleus partout sur corps.
8252,J'y ai pas mal réfléchi.
8253,C'était à Brentwood.
8254,Ni le Far West.
8255,"Hedy, la serveuse, n'a pas eu peur."
8256,Il m'a dévisagé bizarrement.
8257,Des disparitions de jeunes filles étaient là.
8258,Le soutien du SWAT sera nécessaire.
8259,C'était un établissement infâme.
8260,Il observait le sang s'écouler.
8261,Il ramena son bras droit dans dos.
8262,L'arrestation s'est déroulée à Morro Bay.
8263,Les chiens s'étaient assis.
8264,C'est un psy qui pond des expertises.
8265,J'arrivai à Camarillo en milieu de matinée.
8266,Je pourrai te signaler Shacker.
8267,Parce qu'il n'est pas très net ?
8268,Je ne m'embarrassais plus d'écarter herbes.
8269,Elle n'en avait pas vu.
8270,Ils étaient plus émaciés que sur la photo.
8271,Cette boîte était à Malibu.
8272,Biro revient à la table.
8273,Puis un couinement se fit entendre.
8274,Elle se mêlait aux cacahuètes.
8275,Il a souri.
8276,Mais il m'ignorait totalement.
8277,Et on est là à se tourner les pouces.
8278,Il ouvrit son carreau.
8279,Le grand public n'a pas de scrupules.
8280,"Tiens, qui voilà maintenant ?"
8281,Où a eu lieu la cérémonie ?
8282,Elle demanda : Avait-il d'autres centres d'intérêt ?
8283,Je patientai un instant.
8284,Il fallait démarrer au plus haut niveau.
8285,Elle n'a jamais été revue.
8286,Il portait des nœuds papillon grotesques.
8287,Ces affabulations ne servent à rien.
8288,Le temps m'a l'air idéal.
8289,M. Eccles mendiait avec insistance.
8290,Il a subi le même sort ?
8291,Il fallut recourir à l'anthropologie.
8292,Le jour où Vita nous a agressés.
8293,Il avait vendu des revues de jeux.
8294,Cela ressemblait à une plainte.
8295,Elle n'a pas pu confirmer son diagnostic.
8296,Elle était nettoyée.
8297,Il y avait des yuccas.
8298,"Coloré en jaune, ce serait le frère de M. Smiley."
8299,Le ciel de Beverly Hills émergeait.
8300,pouvoir répondre clairement.
8301,Il s'approche du bureau.
8302,Ils étaient trop abîmés par le formol.
8303,"Mon Dieu, c'est là que je l'ai déposé."
8304,Je peinais à voir ce que Harrie en retirait.
8305,Je plantai mes deux ongles dans chair.
8306,Il se tenait toujours le cou.
8307,Il l'a laissé sur le cadavre.
8308,Le directeur du personnel rappelait.
8309,Il était un gamin.
8310,Borchard fit la moue.
8311,Raul appela ensuite Petra.
8312,Elle pleurait parce qu'elle avait faim.
8313,Nous ne savions comment il faisait.
8314,Le regard était sans vie.
8315,Il était de la taille d'une cerise.
8316,Il avait le temps d'être attentif.
8317,Harrie a peut-être pris soin.
8318,Devine quoi ?
8319,Elle travaillait en oncologie.
8320,"De retour dans le tunnel, nous entrâmes."
8321,"Sacré progrès, n'est-ce pas ?"
8322,Qu'y a-t-il à la place?
8323,Elles menaient vers la cuisine.
8324,Le docteur avait pris l'avion.
8325,Il me fit signe de me taire.
8326,C'est pour une petite virée.
8327,Je ne dis pas que vous ne fichez rien.
8328,Il se releva en position assise.
8329,La femme assise à côté bondit.
8330,Je connais un psychologue.
8331,On en vend à l'intention des optométristes.
8332,Ses traits étaient émaciés.
8333,"Ensuite, j'ai fait le lâche."
8334,C'était sur la porte d'entrée.
8335,Robin demanda : Pour se donner une excuse ?
8336,Certains d'entre eux le savent.
8337,Elles n'avaient rien signalé.
8338,J'essaierai de fournir des indications.
8339,Elle l'avait traité de charlatan.
8340,J'ai tenté de joindre Petra.
8341,Il s'appelait Louis Wainright.
8342,Le garçon était assis à côté.
8343,Il se remit à pianoter.
8344,"C'était une expérience, à la vérité."
8345,Elle était en petites lettres dorées.
8346,C'est pour ça qu'elle parle.
8347,Nous appréhenderons la personne qui l'a tué.
8348,Biro demande comme ?.
8349,Je les lui transmets le vendredi.
8350,Ce n'est pas tout.
8351,Les salauds ne furent jamais arrêtés.
8352,"Pour la visite complète, c'est plus cher !"
8353,Voir comment l'on réagit.
8354,C'était une Acura bleue.
8355,Il occupa un poste à Ventura.
8356,Son SUV fut retrouvé.
8357,C'étaient quelques bâtiments grossiers.
8358,J'ai fait monter Madeleine et Cerise.
8359,C'était un vieillard maigre et chenu.
8360,Ses yeux semblaient éteints.
8361,Notre directeur n'était qu'un incapable.
8362,Vous avez hérité du garçon.
8363,Elle laissait deux filles.
8364,Elle a une vue sur la mer.
8365,Notre attention était fixée sur un endroit.
8366,Raul demande ce qu'ils sont alors.
8367,Je n'aurais pas été surpris.
8368,C'était depuis trois jours.
8369,Merci pour le tuyau.
8370,Le papier avait gondolé.
8371,Quel était ce délire ?
8372,Ils furent obtenus sur internet.
8373,Il poussait un passant quand il mendiait.
8374,Les locataires avaient leur propre clé.
8375,Il croise un jeune homme.
8376,Elle huma l'habitacle.
8377,Je comprends tout à fait.
8378,Ce n'est pas significatif.
8379,J'en profitai pour appeler.
8380,C'est pour se procurer des espèces.
8381,es pas que c'est moi.
8382,Un quidam aux prises avec un cinglé.
8383,Milo s'ébroua soudain.
8384,Une idée pour son guet-apens.
8385,Mag avait cet effet sur nous.
8386,Mes réserves sont purement égoïstes.
8387,Cela pourrait fournir des indications sur ses proches.
8388,Je l'ai déposé où ça l'arrangeait.
8389,Le Café Moghol était désert.
8390,Il était derrière les provisions.
8391,Je frappai à la porte Donna.
8392,Le PV pour la dernière arrestation d'Eccles?
8393,Il posa quelques questions supplémentaires.
8394,J'insisterais auprès du neveu Cahane.
8395,Suicide par flic interposé.
8396,Elle promenait un bébé.
8397,Robin huma l'air ambiant.
8398,Et même un deuxième week-end.
8399,Milo grignotait ces friandises.
8400,Il n'y eut aucune concertation.
8401,Huggler a assisté à la scène.
8402,Pour une prison sans doute plusieurs années.
8403,Elle ne s'est pas améliorée.
8404,Pas pour l'homme à la canadienne.
8405,Il pria le conducteur de patienter.
8406,J'évoquerai l'accusation de charlatanisme.
8407,C'étaient des ouvrages de base.
8408,Dr Magnus Vanderveul.
8409,"Lors de votre stage, avez-vous vu quelque chose ?"
8410,Vos conditions sont strictes ?
8411,Une plaque métallique s'insérait dans le sol.
8412,"Non, par contre quelque chose me revient."
8413,Il avait usurpé d'autres identités.
8414,Il envoya le garçon en clinique.
8415,Je n'en avais pas entendu parler.
8416,Reed parie sur le nom du cautionneur.
8417,Elle m'expliqua la situation brièvement.
8418,que leurs médecins sont bénévoles.
8419,C'était du même ton crème.
8420,Même route bordée de vieux arbres.
8421,Elle trouve un prolongement professionnel.
8422,C'était anormal pour la race.
8423,Il a payé avec de la monnaie.
8424,C'était de l'hôpital psychiatrique.
8425,Où est-ce arrivé ?
8426,Ça n'a fait qu'aiguiser son appétit !
8427,il avait le souffle précipité.
8428,Cela te dérange-t-il?
8429,Il roula sur le sol.
8430,Elle était parfaitement aplanie.
8431,Il cherchait peut-être des médicaments.
8432,que ça l'aiderait.
8433,Un contrôle suffirait.
8434,"Par contre, si c'est la rage qui prime,"
8435,Votre mère n'a rien évoqué ?
8436,Le monstre a déposé le bocal.
8437,C'était au délicatessen du coin.
8438,"Quand cela fut fait, Louie tapota la terre."
8439,Ils souffrent de Dieu sait quelles maladies.
8440,Je n'y vois pas d'inconvénient.
8441,Il nous fit signe de descendre.
8442,Un était du groupe O.
8443,Les montagnes étaient à l'est.
8444,Je me demandais s'ils connaissaient.
8445,Cela s'organisera à votre convenance.
8446,"Quand il revint, il avait repris des couleurs."
8447,Il étira ses longues jambes.
8448,"Le nombre de patients, les urgences."
8449,On peut argumenter que les administrateurs.
8450,Cerise a cinq ans.
8451,La corde était passée autour du cou.
8452,Il était fou au sens propre.
8453,Blanche ronflait doucement blottie entre nous.
8454,Il a laissé des pièces.
8455,Son museau était fin et allongé.
8456,Ils ne sont pas soumis aux mêmes obligations.
8457,Je redoutais qu'il me fasse honte.
8458,C'était lors de son recrutement.
8459,J'ai résolu de le faire interner.
8460,Je voulais l'avertir de ma présence.
8461,"Non, on dessine encore à la main."
8462,Biro s'étonne de la facilité.
8463,C'est un charlatan à Beverly Hills.
8464,Et si le dossier n'est pas retiré.
8465,Il attire aussi les gens de passage.
8466,C'était grâce à un circuit électrique.
8467,Robin et moi sommes allés observer des baleines.
8468,Elles n'étaient plus que des taches informes.
8469,Redresser des torts réels ou imaginaires.
8470,"Petra, Moe Reed, Raul Biro étaient là."
8471,Il n'est pas allé plus haut.
8472,L'eau venait de nos bouteilles.
8473,Cela donne des mécaniciens.
8474,Je l'ai bombardé de questions.
8475,Le temps d'intervention était court.
8476,Il s'occupait de baux.
8477,J'ai parcouru les lieux.
8478,Les résidents pourraient mal interpréter.
8479,Il a trouvé plus jouissif de voir Eccles.
8480,"À Miami, par hasard ?"
8481,Milo et moi étions allés au Bijou.
8482,Il jouait au basket.
8483,Il était un peu déréglé.
8484,Le psychologue de Ventura avait quatre-vingts ans.
8485,Mais ils épargnent ces deux-là ?
8486,C'était son expression exacte.
8487,Le meuble de droite était encombré.
8488,Raul demande quel genre de questions.
8489,"Elle est adorable, dis-je."
8490,"Maudits technocrates !, aboya-t-il."
8491,L'homme veillant sur le champ n'a bougé.
8492,Ce serait comme Harrie.
8493,Son visage était inexpressif.
8494,Il se souvienne de son nom.
8495,"Non, non, non."
8496,Ils ont repris du poids.
8497,Il n'a pas l'air menaçant.
8498,La voie de service coupe par l'arrière.
8499,J'ai toujours soupçonné une vengeance.
8500,que c'est pour un cours.
8501,Cet emplacement était à sa forme.
8502,"Elle demande l'autre aussi, le psychologue."
8503,Il n'a recueilli aucun grief précis.
8504,Je faisais tinter les glaçons.
8505,Trente années de métier passent.
8506,Pourquoi pas une autre identité?
8507,Voyez-vous quelqu'un d'autre ?
8508,Je ne me mêle pas de ces histoires.
8509,Papier de qualité.
8510,Ce fut vingt-quatre jours sur le paquebot.
8511,C'était peut-être une visite de contrôle.
8512,Elle demandait :  Pourquoi moi ?
8513,J'ai composé le numéro de Raul.
8514,Nos suppositions sont fondées.
8515,Pitty a réellement existé.
8516,Madeleine est très rationnelle.
8517,Rien n'indiquait la présence d'un hôpital.
8518,"Pourquoi ?"", demanda Milo."
8519,Il était de la même marque que les tables.
8520,Il a commis des crimes atroces.
8521,Un pic à glace avait percé des étoiles.
8522,J'ai réagi à votre message.
8523,Cette personne rendait visite à Eccles.
8524,Elle est verrouillée en permanence.
8525,Il a peut-être trouvé par hasard.
8526,Une femme avait beaucoup de contraventions.
8527,Je suggérai : Peut-être qu'il a temporisé.
8528,J'avais expertisé chaque patient.
8529,"Si j'obtiens une adresse, on planifie une descente."
8530,Shimoff avait reconstitué un portrait.
8531,Cela correspond aux signalements.
8532,C'était Sean Binchy.
8533,Le japonais me tentait bien.
8534,Il demanda une équipe de la police scientifique.
8535,Une tache sautillante au milieu de l'étendue.
8536,Ils s'étaient quittés en bons termes.
8537,Il voulait être convaincant dans son rôle.
8538,Les trottoirs étaient déserts.
8539,Qu'elle soit fière de toi.
8540,Il agissait sous ma responsabilité.
8541,Il regarda le portrait de Huggler.
8542,"Un peu plus tard, une infirmière demanda."
8543,Il faudra se serrer un peu.
8544,Un chirurgien et son épouse.
8545,C'était une mise en scène.
8546,C'était un cadeau de dix ans.
8547,Un Blanc comme Huggler passerait inaperçu.
8548,Qu'est-ce que je peux faire ?
8549,C'est une étrange organisation.
8550,Le fait que vous travaillez avec l'inspecteur.
8551,Il portait des pantoufles en chevreau noir.
8552,Ce n'était pas un prodige.
8553,Leurs lampes torches restèrent éteintes.
8554,C'est précisément le but.
8555,Elle avait attrapé la tuberculose.
8556,Nouvelle consultation de l'iPhone.
8557,Je retins Ned par la peau.
8558,Milo s'était étonné.
8559,Huggler acquiesça doucement.
8560,Elles mettaient en place un programme.
8561,Milo me l'avait fournie.
8562,Aucune paire de lunettes n'était visible.
8563,"Je l'encourageai : ""Por favor."
8564,Le grand fauteuil en cuir était vide.
8565,Ses cheveux courts grisonnaient.
8566,Il y avait quelques vêtements masculins.
8567,Ce n'est pas un nom courant.
8568,"Pitty, dont ce n'est pas le nom."
8569,Elle était gris métallisé.
8570,Les analyses ADN prendraient du temps.
8571,Marmonna-t-il en ouvrant le tiroir.
8572,Il ne balaye pas.
8573,Son permis n'est plus valide.
8574,Personne ne la retint.
8575,J'avais haussé le ton.
8576,Un livre était posé là.
8577,Il s'est contenté d'apprendre le jargon.
8578,C'était celui de James Pittson Harrie.
8579,Racontez à votre chef ensuite.
8580,Il ne déclencha pas le pêne.
8581,Cela veut dire qu'il a commis un meurtre.
8582,Ces patients étaient indemnisés.
8583,Il figurait du pain et des fruits.
8584,Je répondis : La comptabilité.
8585,Il demanda l'aide de Scan Binchy.
8586,Il pouvait prendre sous sa coupe un adolescent.
8587,J'ai vu l'homme de près.
8588,C'était une histoire banale.
8589,"Maintenant, si les tunnels étaient en service,"
8590,"Quand bien même vous seriez sincère,"
8591,Tout est possible ici.
8592,J'ai fait appel à lui.
8593,Cela remonte donc à 24 ans.
8594,On ne l'a plus revu.
8595,Il aurait fait valoir ces points.
8596,Robin quitta la pièce.
8597,Victime numéro cinq.
8598,Et au pepperoni aussi.
8599,Leur maître était une civile.
8600,J'y avais été accueillie.
8601,Le premier fut fait avec Wheeling.
8602,Je m'y suis donc rendu.
8603,Elle s'est opposée.
8604,Je me suis attardé un peu.
8605,J'ai vite trouvé l'avis de décès.
8606,Il raccrocha ensuite.
8607,Il s'excusait envers Huggler.
8608,Nous nous assurions que personne épiait.
8609,Je m'arrêtai chez un marchand.
8610,La paperasse va nous occuper.
8611,Aucun patient ne s'était conduit ainsi.
8612,Le jeune Quigg soupçonnait quelque chose.
8613,Milo d'un ton grave.
8614,Elle m'a fait part de ce hasard.
8615,"Et voici Ned, dis-je."
8616,Ils étaient au même endroit.
8617,Il fut renvoyé illico au pays des songes.
8618,C'est de psy à psy.
